Bus Hound 6.00 capture on Windows Vista Service Pack 1 (x64). Complements of www.perisoft.net

adb_auth

  Device - Device ID (followed by the endpoint for USB devices)
            (14) Android ADB Interface
            (23) USB Composite Device
            (25) Android ADB Interface
  Phase  - Phase Type
            CTL   USB control transfer       
            IN    Data in transfer           
            OUT   Data out transfer          
            URB   USB request block          
            USTS  USB status                 
  Data   - Hex dump of the data transferred
  Descr  - Description of the phase
  Cmd... - Position in the captured data


Device  Phase  Data         Description       Cmd.Phase.Ofs(rep)
------  -----  -----------  ----------------  ------------------
  25    IN                                           1.1.0        
  25.2  USTS   c0007000     no device                2.1.0        
  23.0  CTL    80 06 00 01  GET DESCRIPTOR           3.1.0        
               00 00 12 00                           3.1.4        
  23.0  IN     12 01 00 02  ....                     3.2.0        
               00 00 00 40  ...@                     3.2.4        
               95 2d 11 60  .-.`                     3.2.8        
               14 04 01 02  ....                     3.2.12       
               03 01        ..                       3.2.16       
  23.0  CTL    80 06 00 02  GET DESCRIPTOR           4.1.0        
               00 00 09 00                           4.1.4        
  23.0  IN     09 02 37 00  ..7.                     4.2.0        
               02 01 04 80  ....                     4.2.4        
               fa           .                        4.2.8        
  23.0  CTL    80 06 00 02  GET DESCRIPTOR           5.1.0        
               00 00 37 00                           5.1.4        
  23.0  IN     09 02 37 00  ..7.                     5.2.0        
               02 01 04 80  ....                     5.2.4        
               fa 09 04 00  ....                     5.2.8        
               00 02 08 06  ....                     5.2.12       
               50 05 07 05  P...                     5.2.16       
               81 02 00 02  ....                     5.2.20       
               00 07 05 01  ....                     5.2.24       
               02 00 02 01  ....                     5.2.28       
  23.0  CTL    00 09 01 00  SET CONFIG               6.1.0        
               00 00 00 00                           6.1.4        
  23.0  IN     28 00 00 00  (...                     7.1.0        
               00 01 04 00  ....                     7.1.4        
               01 00 00 00  ....                     7.1.8        
               00 00 00 00  ....                     7.1.12       
  23.0  IN     28 00 00 00  (...                     8.1.0        
               00 01 04 00  ....                     8.1.4        
               01 00 00 00  ....                     8.1.8        
               00 00 00 00  ....                     8.1.12       
               01 01 57 49  ..WI                     8.1.16       
               4e 55 53 42  NUSB                     8.1.20       
               00 00 00 00  ....                     8.1.24       
               00 00 00 00  ....                     8.1.28       
  23.0  CTL    80 06 05 03  GET DESCRIPTOR           9.1.0        
               09 04 04 00                           9.1.4        
  23.0  IN     1a 03 4d 00  ..M.                     9.2.0        
  23.0  CTL    80 06 05 03  GET DESCRIPTOR          10.1.0        
               09 04 1a 00                          10.1.4        
  23.0  IN     1a 03 4d 00  ..M.                    10.2.0        
               61 00 73 00  a.s.                    10.2.4        
               73 00 20 00  s. .                    10.2.8        
               53 00 74 00  S.t.                    10.2.12       
               6f 00 72 00  o.r.                    10.2.16       
               61 00 67 00  a.g.                    10.2.20       
               65 00        e.                      10.2.24       
  23.0  CTL    80 06 07 03  GET DESCRIPTOR          11.1.0        
               09 04 04 00                          11.1.4        
  23.0  IN     1c 03 41 00  ..A.                    11.2.0        
  23.0  CTL    80 06 07 03  GET DESCRIPTOR          12.1.0        
               09 04 1c 00                          12.1.4        
  23.0  IN     1c 03 41 00  ..A.                    12.2.0        
               44 00 42 00  D.B.                    12.2.4        
               20 00 49 00   .I.                    12.2.8        
               6e 00 74 00  n.t.                    12.2.12       
               65 00 72 00  e.r.                    12.2.16       
               66 00 61 00  f.a.                    12.2.20       
               63 00 65 00  c.e.                    12.2.24       
  25.0  CTL    80 06 00 01  GET DESCRIPTOR          13.1.0        
               00 00 12 00                          13.1.4        
  25.0  IN     12 01 00 02  ....                    13.2.0        
               00 00 00 40  ...@                    13.2.4        
               95 2d 11 60  .-.`                    13.2.8        
               14 04 01 07  ....                    13.2.12       
               03 01        ..                      13.2.16       
  25.0  CTL    80 06 00 02  GET DESCRIPTOR          14.1.0        
               00 00 09 00                          14.1.4        
  25.0  IN     09 02 20 00  .. .                    14.2.0        
               01 01 04 80  ....                    14.2.4        
               fa           .                       14.2.8        
  25.0  CTL    80 06 00 02  GET DESCRIPTOR          15.1.0        
               00 00 20 00                          15.1.4        
  25.0  IN     09 02 20 00  .. .                    15.2.0        
               01 01 04 80  ....                    15.2.4        
               fa 09 04 01  ....                    15.2.8        
               00 02 ff 42  ...B                    15.2.12       
               01 07 07 05  ....                    15.2.16       
               02 02 00 02  ....                    15.2.20       
               00 07 05 82  ....                    15.2.24       
               02 00 02 00  ....                    15.2.28       
  25.0  CTL    80 00 00 00  GET STATUS              16.1.0        
               00 00 02 00                          16.1.4        
  25.0  IN     00 00        ..                      16.2.0        
  25.0  CTL    00 09 01 00  SET CONFIG              17.1.0        
               00 00 00 00                          17.1.4        
  25.0  CTL    80 06 03 03  GET DESCRIPTOR          18.1.0        
               09 04 40 00                          18.1.4        
  25.0  IN     12 03 36 00  ..6.                    18.2.0        
               36 00 37 00  6.7.                    18.2.4        
               32 00 65 00  2.e.                    18.2.8        
               65 00 34 00  e.4.                    18.2.12       
               63 00        c.                      18.2.16       
  25.2  IN     57 52 54 45  WRTE                    19.1.0        
               10 00 00 00  ....                    19.1.4        
               a8 04 00 00  ....                    19.1.8        
               79 00 00 00  y...                    19.1.12       
               7c 23 00 00  .#..                    19.1.16       
               a8 ad ab ba  ....                    19.1.20       
  25.2  OUT    43 4e 58 4e  CNXN                    20.1.0        
               01 00 00 01  ....                    20.1.4        
               00 00 10 00  ....                    20.1.8        
               ea 00 00 00  ....                    20.1.12       
               44 5b 00 00  D[..                    20.1.16       
               bc b1 a7 b1  ....                    20.1.20       
  25.2  IN     5b 20 20 20  [                       21.1.0        
               20 20 20 20                          21.1.4        
               20 20 20 31     1                    21.1.8        
               36 32 34 35  6245                    21.1.12       
               32 33 32 35  2325                    21.1.16       
               34 2e 33 39  4.39                    21.1.20       
               30 20 32 36  0 26                    21.1.24       
               39 32 30 3a  920:                    21.1.28       
  25.2  OUT    68 6f 73 74  host                    22.1.0        
               3a 3a 66 65  ::fe                    22.1.4        
               61 74 75 72  atur                    22.1.8        
               65 73 3d 73  es=s                    22.1.12       
               68 65 6c 6c  hell                    22.1.16       
               5f 76 32 2c  _v2,                    22.1.20       
               63 6d 64 2c  cmd,                    22.1.24       
               73 74 61 74  stat                    22.1.28       
  25.2  IN     43 4c 53 45  CLSE                    23.1.0        
               10 00 00 00  ....                    23.1.4        
               a8 04 00 00  ....                    23.1.8        
               00 00 00 00  ....                    23.1.12       
               00 00 00 00  ....                    23.1.16       
               bc b3 ac ba  ....                    23.1.20       
  25.2  IN     41 55 54 48  AUTH                    24.1.0        
               01 00 00 00  ....                    24.1.4        
               00 00 00 00  ....                    24.1.8        
               14 00 00 00  ....                    24.1.12       
               00 00 00 00  ....                    24.1.16       
               be aa ab b7  ....                    24.1.20       
  25.2  IN     6c 97 f9 ca  l...                    25.1.0        
               53 48 6f 4d  SHoM                    25.1.4        
               03 27 94 cc  .'..                    25.1.8        
               f8 df 67 40  ..g@                    25.1.12       
               0f c1 24 26  ..$&                    25.1.16       
  25.2  OUT    41 55 54 48  AUTH                    26.1.0        
               02 00 00 00  ....                    26.1.4        
               00 00 00 00  ....                    26.1.8        
               00 01 00 00  ....                    26.1.12       
               eb 7f 00 00  ....                    26.1.16       
               be aa ab b7  ....                    26.1.20       
  25.2  OUT    46 fe a9 63  F..c                    27.1.0        
               64 23 cd a7  d#..                    27.1.4        
               2f 2e 93 06  /...                    27.1.8        
               16 af 3b da  ..;.                    27.1.12       
               23 ca 5e 5e  #.^^                    27.1.16       
               8d da ff 3c  ...<                    27.1.20       
               a8 c7 f3 e7  ....                    27.1.24       
               e1 38 43 ed  .8C.                    27.1.28       
  25.2  IN     41 55 54 48  AUTH                    28.1.0        
               01 00 00 00  ....                    28.1.4        
               00 00 00 00  ....                    28.1.8        
               14 00 00 00  ....                    28.1.12       
               00 00 00 00  ....                    28.1.16       
               be aa ab b7  ....                    28.1.20       
  25.2  IN     22 81 ce 16  "...                    29.1.0        
               50 8e d9 6e  P..n                    29.1.4        
               62 c3 2d 0b  b.-.                    29.1.8        
               bf 03 b3 2c  ...,                    29.1.12       
               dc 35 cd 02  .5..                    29.1.16       
  25.2  OUT    41 55 54 48  AUTH                    30.1.0        
               03 00 00 00  ....                    30.1.4        
               00 00 00 00  ....                    30.1.8        
               ce 02 00 00  ....                    30.1.12       
               a9 ef 00 00  ....                    30.1.16       
               be aa ab b7  ....                    30.1.20       
  25.2  OUT    51 41 41 41  QAAA                    31.1.0        
               41 4d 30 72  AM0r                    31.1.4        
               4d 43 54 37  MCT7                    31.1.8        
               52 76 64 75  Rvdu                    31.1.12       
               36 64 7a 66  6dzf                    31.1.16       
               6c 46 63 57  lFcW                    31.1.20       
               43 57 33 50  CW3P                    31.1.24       
               41 73 68 6d  Ashm                    31.1.28       
  25.2  IN     43 4e 58 4e  CNXN                    32.1.0        
               01 00 00 01  ....                    32.1.4        
               00 00 10 00  ....                    32.1.8        
               e0 00 00 00  ....                    32.1.12       
               00 00 00 00  ....                    32.1.16       
               bc b1 a7 b1  ....                    32.1.20       
  25.2  IN     64 65 76 69  devi                    33.1.0        
               63 65 3a 3a  ce::                    33.1.4        
               72 6f 2e 70  ro.p                    33.1.8        
               72 6f 64 75  rodu                    33.1.12       
               63 74 2e 6e  ct.n                    33.1.16       
               61 6d 65 3d  ame=                    33.1.20       
               50 44 31 39  PD19                    33.1.24       
               32 32 3b 72  22;r                    33.1.28       
  25.2  OUT    4f 50 45 4e  OPEN                    34.1.0        
               06 00 00 00  ....                    34.1.4        
               00 00 00 00  ....                    34.1.8        
               19 00 00 00  ....                    34.1.12       
               00 00 00 00  ....                    34.1.16       
               b0 af ba b1  ....                    34.1.20       
  25.2  OUT    73 68 65 6c  shel                    35.1.0        
               6c 2c 76 32  l,v2                    35.1.4        
               2c 72 61 77  ,raw                    35.1.8        
               3a 6c 73 20  :ls                     35.1.12       
               2f 73 64 63  /sdc                    35.1.16       
               61 72 64 2f  ard/                    35.1.20       
               00           .                       35.1.24       
  25.2  IN     4f 4b 41 59  OKAY                    36.1.0        
               11 00 00 00  ....                    36.1.4        
               06 00 00 00  ....                    36.1.8        
               00 00 00 00  ....                    36.1.12       
               00 00 00 00  ....                    36.1.16       
               b0 b4 be a6  ....                    36.1.20       
  25.2  OUT    57 52 54 45  WRTE                    37.1.0        
               06 00 00 00  ....                    37.1.4        
               11 00 00 00  ....                    37.1.8        
               11 00 00 00  ....                    37.1.12       
               00 00 00 00  ....                    37.1.16       
               a8 ad ab ba  ....                    37.1.20       
  25.2  OUT    05 0c 00 00  ....                    38.1.0        
               00 31 32 30  .120                    38.1.4        
               78 31 38 30  x180                    38.1.8        
               2c 30 78 30  ,0x0                    38.1.12       
               00           .                       38.1.16       
  25.2  IN     4f 4b 41 59  OKAY                    39.1.0        
               11 00 00 00  ....                    39.1.4        
               06 00 00 00  ....                    39.1.8        
               00 00 00 00  ....                    39.1.12       
               00 00 00 00  ....                    39.1.16       
               b0 b4 be a6  ....                    39.1.20       
  25.2  IN     57 52 54 45  WRTE                    40.1.0        
               11 00 00 00  ....                    40.1.4        
               06 00 00 00  ....                    40.1.8        
               32 00 00 00  2...                    40.1.12       
               00 00 00 00  ....                    40.1.16       
               a8 ad ab ba  ....                    40.1.20       
  25.2  IN     01 02 00 00  ....                    41.1.0        
               00 31 0a 01  .1..                    41.1.4        
               11 00 00 00  ....                    41.1.8        
               31 33 33 34  1334                    41.1.12       
               30 33 63 39  03c9                    41.1.16       
               66 39 63 61  f9ca                    41.1.20       
               30 36 63 66  06cf                    41.1.24       
               0a 01 04 00  ....                    41.1.28       
  25.2  OUT    4f 4b 41 59  OKAY                    42.1.0        
               06 00 00 00  ....                    42.1.4        
               11 00 00 00  ....                    42.1.8        
               00 00 00 00  ....                    42.1.12       
               00 00 00 00  ....                    42.1.16       
               b0 b4 be a6  ....                    42.1.20       
  25.2  IN     57 52 54 45  WRTE                    43.1.0        
               11 00 00 00  ....                    43.1.4        
               06 00 00 00  ....                    43.1.8        
               33 04 00 00  3...                    43.1.12       
               00 00 00 00  ....                    43.1.16       
               a8 ad ab ba  ....                    43.1.20       
  25.2  IN     01 13 00 00  ....                    44.1.0        
               00 33 36 30  .360                    44.1.4        
               e6 99 ba e8  ....                    44.1.8        
               83 bd e6 91  ....                    44.1.12       
               84 e5 83 8f  ....                    44.1.16       
               e6 9c ba 0a  ....                    44.1.20       
               01 13 00 00  ....                    44.1.24       
               00 33 36 30  .360                    44.1.28       
  25.2  OUT    4f 4b 41 59  OKAY                    45.1.0        
               06 00 00 00  ....                    45.1.4        
               11 00 00 00  ....                    45.1.8        
               00 00 00 00  ....                    45.1.12       
               00 00 00 00  ....                    45.1.16       
               b0 b4 be a6  ....                    45.1.20       
  25.2  IN     57 52 54 45  WRTE                    46.1.0        
               11 00 00 00  ....                    46.1.4        
               06 00 00 00  ....                    46.1.8        
               36 07 00 00  6...                    46.1.12       
               00 00 00 00  ....                    46.1.16       
               a8 ad ab ba  ....                    46.1.20       
  25.2  IN     01 0d 00 00  ....                    47.1.0        
               00 62 69 6e  .bin                    47.1.4        
               61 72 79 36  ary6                    47.1.8        
               34 2e 62 69  4.bi                    47.1.12       
               6e 0a 01 04  n...                    47.1.16       
               00 00 00 62  ...b                    47.1.20       
               6c 6d 0a 01  lm..                    47.1.24       
               06 00 00 00  ....                    47.1.28       
  25.2  OUT    4f 4b 41 59  OKAY                    48.1.0        
               06 00 00 00  ....                    48.1.4        
               11 00 00 00  ....                    48.1.8        
               00 00 00 00  ....                    48.1.12       
               00 00 00 00  ....                    48.1.16       
               b0 b4 be a6  ....                    48.1.20       
  25.2  IN     57 52 54 45  WRTE                    49.1.0        
               11 00 00 00  ....                    49.1.4        
               06 00 00 00  ....                    49.1.8        
               06 00 00 00  ....                    49.1.12       
               00 00 00 00  ....                    49.1.16       
               a8 ad ab ba  ....                    49.1.20       
  25.2  IN     03 01 00 00  ....                    50.1.0        
               00 00        ..                      50.1.4        
  25.2  OUT    4f 4b 41 59  OKAY                    51.1.0        
               06 00 00 00  ....                    51.1.4        
               11 00 00 00  ....                    51.1.8        
               00 00 00 00  ....                    51.1.12       
               00 00 00 00  ....                    51.1.16       
               b0 b4 be a6  ....                    51.1.20       
  25.2  IN     43 4c 53 45  CLSE                    52.1.0        
               11 00 00 00  ....                    52.1.4        
               06 00 00 00  ....                    52.1.8        
               00 00 00 00  ....                    52.1.12       
               00 00 00 00  ....                    52.1.16       
               bc b3 ac ba  ....                    52.1.20       
  25.2  OUT    43 4c 53 45  CLSE                    53.1.0        
               06 00 00 00  ....                    53.1.4        
               11 00 00 00  ....                    53.1.8        
               00 00 00 00  ....                    53.1.12       
               00 00 00 00  ....                    53.1.16       
               bc b3 ac ba  ....                    53.1.20       
  25.2  IN     43 4c 53 45  CLSE                    54.1.0(2)     
               11 00 00 00  ....                    54.1.4        
               06 00 00 00  ....                    54.1.8        
               00 00 00 00  ....                    54.1.12       
               00 00 00 00  ....                    54.1.16       
               bc b3 ac ba  ....                    54.1.20       
  25.2  OUT    4f 50 45 4e  OPEN                    56.1.0        
               09 00 00 00  ....                    56.1.4        
               00 00 00 00  ....                    56.1.8        
               19 00 00 00  ....                    56.1.12       
               00 00 00 00  ....                    56.1.16       
               b0 af ba b1  ....                    56.1.20       
  25.2  URB    80 00 09 00  BULK/INT XFER           56.2.0        
               00 00 00 00                          56.2.4        
               d0 e7 d5 05                          56.2.8        
               80 fa ff ff                          56.2.12       
               20 00 00 00                          56.2.16       
               00 00 00 00                          56.2.20       
               38 55 8d 03                          56.2.24       
               80 fa ff ff                          56.2.28       
  25.2  OUT    73 68 65 6c  shel                    57.1.0        
               6c 2c 76 32  l,v2                    57.1.4        
               2c 72 61 77  ,raw                    57.1.8        
               3a 6c 73 20  :ls                     57.1.12       
               2f 73 64 63  /sdc                    57.1.16       
               61 72 64 2f  ard/                    57.1.20       
               00           .                       57.1.24       
  25.2  URB    80 00 09 00  BULK/INT XFER           57.2.0        
               00 00 00 00                          57.2.4        
               d0 e7 d5 05                          57.2.8        
               80 fa ff ff                          57.2.12       
               20 00 00 00                          57.2.16       
               00 00 00 00                          57.2.20       
               38 55 8d 03                          57.2.24       
               80 fa ff ff                          57.2.28       
  25.2  IN     4f 4b 41 59  OKAY                    58.1.0        
               12 00 00 00  ....                    58.1.4        
               09 00 00 00  ....                    58.1.8        
               00 00 00 00  ....                    58.1.12       
               00 00 00 00  ....                    58.1.16       
               b0 b4 be a6  ....                    58.1.20       
  25.2  URB    80 00 09 00  BULK/INT XFER           58.2.0        
               00 00 00 00                          58.2.4        
               d0 e7 d5 05                          58.2.8        
               80 fa ff ff                          58.2.12       
               20 00 00 00                          58.2.16       
               00 00 00 00                          58.2.20       
               68 55 8d 03                          58.2.24       
               80 fa ff ff                          58.2.28       
  25.2  OUT    57 52 54 45  WRTE                    59.1.0        
               09 00 00 00  ....                    59.1.4        
               12 00 00 00  ....                    59.1.8        
               11 00 00 00  ....                    59.1.12       
               00 00 00 00  ....                    59.1.16       
               a8 ad ab ba  ....                    59.1.20       
  25.2  URB    80 00 09 00  BULK/INT XFER           59.2.0        
               00 00 00 00                          59.2.4        
               d0 e7 d5 05                          59.2.8        
               80 fa ff ff                          59.2.12       
               20 00 00 00                          59.2.16       
               00 00 00 00                          59.2.20       
               38 55 8d 03                          59.2.24       
               80 fa ff ff                          59.2.28       
  25.2  OUT    05 0c 00 00  ....                    60.1.0        
               00 31 32 30  .120                    60.1.4        
               78 31 38 30  x180                    60.1.8        
               2c 30 78 30  ,0x0                    60.1.12       
               00           .                       60.1.16       
  25.2  URB    80 00 09 00  BULK/INT XFER           60.2.0        
               00 00 00 00                          60.2.4        
               d0 e7 d5 05                          60.2.8        
               80 fa ff ff                          60.2.12       
               20 00 00 00                          60.2.16       
               00 00 00 00                          60.2.20       
               38 55 8d 03                          60.2.24       
               80 fa ff ff                          60.2.28       
  25.2  IN     4f 4b 41 59  OKAY                    61.1.0        
               12 00 00 00  ....                    61.1.4        
               09 00 00 00  ....                    61.1.8        
               00 00 00 00  ....                    61.1.12       
               00 00 00 00  ....                    61.1.16       
               b0 b4 be a6  ....                    61.1.20       
  25.2  URB    80 00 09 00  BULK/INT XFER           61.2.0        
               00 00 00 00                          61.2.4        
               d0 e7 d5 05                          61.2.8        
               80 fa ff ff                          61.2.12       
               20 00 00 00                          61.2.16       
               00 00 00 00                          61.2.20       
               68 55 8d 03                          61.2.24       
               80 fa ff ff                          61.2.28       
  25.2  IN     57 52 54 45  WRTE                    62.1.0        
               12 00 00 00  ....                    62.1.4        
               09 00 00 00  ....                    62.1.8        
               26 00 00 00  &...                    62.1.12       
               00 00 00 00  ....                    62.1.16       
               a8 ad ab ba  ....                    62.1.20       
  25.2  URB    80 00 09 00  BULK/INT XFER           62.2.0        
               00 00 00 00                          62.2.4        
               d0 e7 d5 05                          62.2.8        
               80 fa ff ff                          62.2.12       
               20 00 00 00                          62.2.16       
               00 00 00 00                          62.2.20       
               68 55 8d 03                          62.2.24       
               80 fa ff ff                          62.2.28       
  25.2  IN     01 02 00 00  ....                    63.1.0        
               00 31 0a 01  .1..                    63.1.4        
               11 00 00 00  ....                    63.1.8        
               31 33 33 34  1334                    63.1.12       
               30 33 63 39  03c9                    63.1.16       
               66 39 63 61  f9ca                    63.1.20       
               30 36 63 66  06cf                    63.1.24       
               0a 01 04 00  ....                    63.1.28       
  25.2  URB    80 00 09 00  BULK/INT XFER           63.2.0        
               00 00 00 00                          63.2.4        
               d0 e7 d5 05                          63.2.8        
               80 fa ff ff                          63.2.12       
               20 00 00 00                          63.2.16       
               00 00 00 00                          63.2.20       
               68 55 8d 03                          63.2.24       
               80 fa ff ff                          63.2.28       
  25.2  OUT    4f 4b 41 59  OKAY                    64.1.0        
               09 00 00 00  ....                    64.1.4        
               12 00 00 00  ....                    64.1.8        
               00 00 00 00  ....                    64.1.12       
               00 00 00 00  ....                    64.1.16       
               b0 b4 be a6  ....                    64.1.20       
  25.2  URB    80 00 09 00  BULK/INT XFER           64.2.0        
               00 00 00 00                          64.2.4        
               d0 e7 d5 05                          64.2.8        
               80 fa ff ff                          64.2.12       
               20 00 00 00                          64.2.16       
               00 00 00 00                          64.2.20       
               38 55 8d 03                          64.2.24       
               80 fa ff ff                          64.2.28       
  25.2  IN     57 52 54 45  WRTE                    65.1.0        
               12 00 00 00  ....                    65.1.4        
               09 00 00 00  ....                    65.1.8        
               79 07 00 00  y...                    65.1.12       
               00 00 00 00  ....                    65.1.16       
               a8 ad ab ba  ....                    65.1.20       
  25.2  URB    80 00 09 00  BULK/INT XFER           65.2.0        
               00 00 00 00                          65.2.4        
               d0 e7 d5 05                          65.2.8        
               80 fa ff ff                          65.2.12       
               20 00 00 00                          65.2.16       
               00 00 00 00                          65.2.20       
               68 55 8d 03                          65.2.24       
               80 fa ff ff                          65.2.28       
  25.2  IN     01 07 00 00  ....                    66.1.0        
               00 33 36 30  .360                    66.1.4        
               4c 6f 67 0a  Log.                    66.1.8        
               01 13 00 00  ....                    66.1.12       
               00 33 36 30  .360                    66.1.16       
               e6 99 ba e8  ....                    66.1.20       
               83 bd e6 91  ....                    66.1.24       
               84 e5 83 8f  ....                    66.1.28       
  25.2  URB    80 00 09 00  BULK/INT XFER           66.2.0        
               00 00 00 00                          66.2.4        
               d0 e7 d5 05                          66.2.8        
               80 fa ff ff                          66.2.12       
               20 00 00 00                          66.2.16       
               00 00 00 00                          66.2.20       
               68 55 8d 03                          66.2.24       
               80 fa ff ff                          66.2.28       
  25.2  OUT    4f 4b 41 59  OKAY                    67.1.0        
               09 00 00 00  ....                    67.1.4        
               12 00 00 00  ....                    67.1.8        
               00 00 00 00  ....                    67.1.12       
               00 00 00 00  ....                    67.1.16       
               b0 b4 be a6  ....                    67.1.20       
  25.2  URB    80 00 09 00  BULK/INT XFER           67.2.0        
               00 00 00 00                          67.2.4        
               d0 e7 d5 05                          67.2.8        
               80 fa ff ff                          67.2.12       
               20 00 00 00                          67.2.16       
               00 00 00 00                          67.2.20       
               38 55 8d 03                          67.2.24       
               80 fa ff ff                          67.2.28       
  25.2  IN     57 52 54 45  WRTE                    68.1.0        
               12 00 00 00  ....                    68.1.4        
               09 00 00 00  ....                    68.1.8        
               52 04 00 00  R...                    68.1.12       
               00 00 00 00  ....                    68.1.16       
               a8 ad ab ba  ....                    68.1.20       
  25.2  URB    80 00 09 00  BULK/INT XFER           68.2.0        
               00 00 00 00                          68.2.4        
               d0 e7 d5 05                          68.2.8        
               80 fa ff ff                          68.2.12       
               20 00 00 00                          68.2.16       
               00 00 00 00                          68.2.20       
               68 55 8d 03                          68.2.24       
               80 fa ff ff                          68.2.28       
  25.2  IN     01 08 00 00  ....                    69.1.0        
               00 69 52 65  .iRe                    69.1.4        
               61 64 65 72  ader                    69.1.8        
               0a 01 12 00  ....                    69.1.12       
               00 00 69 6e  ..in                    69.1.16       
               74 65 72 6e  tern                    69.1.20       
               65 74 43 6f  etCo                    69.1.24       
               6d 70 6f 6e  mpon                    69.1.28       
  25.2  URB    80 00 09 00  BULK/INT XFER           69.2.0        
               00 00 00 00                          69.2.4        
               d0 e7 d5 05                          69.2.8        
               80 fa ff ff                          69.2.12       
               20 00 00 00                          69.2.16       
               00 00 00 00                          69.2.20       
               68 55 8d 03                          69.2.24       
               80 fa ff ff                          69.2.28       
  25.2  IN     43 4c 53 45  CLSE                    70.1.0        
               12 00 00 00  ....                    70.1.4        
               09 00 00 00  ....                    70.1.8        
               00 00 00 00  ....                    70.1.12       
               00 00 00 00  ....                    70.1.16       
               bc b3 ac ba  ....                    70.1.20       
  25.2  URB    80 00 09 00  BULK/INT XFER           70.2.0        
               00 00 00 00                          70.2.4        
               d0 e7 d5 05                          70.2.8        
               80 fa ff ff                          70.2.12       
               20 00 00 00                          70.2.16       
               00 00 00 00                          70.2.20       
               68 55 8d 03                          70.2.24       
               80 fa ff ff                          70.2.28       
  25.2  OUT    4f 4b 41 59  OKAY                    71.1.0        
               09 00 00 00  ....                    71.1.4        
               12 00 00 00  ....                    71.1.8        
               00 00 00 00  ....                    71.1.12       
               00 00 00 00  ....                    71.1.16       
               b0 b4 be a6  ....                    71.1.20       
  25.2  URB    80 00 09 00  BULK/INT XFER           71.2.0        
               00 00 00 00                          71.2.4        
               d0 e7 d5 05                          71.2.8        
               80 fa ff ff                          71.2.12       
               20 00 00 00                          71.2.16       
               00 00 00 00                          71.2.20       
               38 55 8d 03                          71.2.24       
               80 fa ff ff                          71.2.28       
  25.2  OUT    43 4c 53 45  CLSE                    72.1.0        
               09 00 00 00  ....                    72.1.4        
               12 00 00 00  ....                    72.1.8        
               00 00 00 00  ....                    72.1.12       
               00 00 00 00  ....                    72.1.16       
               bc b3 ac ba  ....                    72.1.20       
  25.2  URB    80 00 09 00  BULK/INT XFER           72.2.0        
               00 00 00 00                          72.2.4        
               d0 e7 d5 05                          72.2.8        
               80 fa ff ff                          72.2.12       
               20 00 00 00                          72.2.16       
               00 00 00 00                          72.2.20       
               38 55 8d 03                          72.2.24       
               80 fa ff ff                          72.2.28       
  25.2  IN     43 4c 53 45  CLSE                    73.1.0        
               12 00 00 00  ....                    73.1.4        
               09 00 00 00  ....                    73.1.8        
               00 00 00 00  ....                    73.1.12       
               00 00 00 00  ....                    73.1.16       
               bc b3 ac ba  ....                    73.1.20       
  25.2  URB    80 00 09 00  BULK/INT XFER           73.2.0        
               00 00 00 00                          73.2.4        
               d0 e7 d5 05                          73.2.8        
               80 fa ff ff                          73.2.12       
               20 00 00 00                          73.2.16       
               00 00 00 00                          73.2.20       
               68 55 8d 03                          73.2.24       
               80 fa ff ff                          73.2.28       
